<?xml version="1.0" encoding="UTF-8"?>
	<!--
    Document   : StandardAdapterConfiguration.xml
    Created on : Sep 06, 2012, 3.24 AM
    Author     : tis1pal
    Description: Configuration File for validations and runtime values
	-->
<iv:configuration xmlns:xsi="http://www.w3.org/2001/XMLSchema-instance" xmlns:iv="http://integration.tmp.bosch.com/validation" xsi:schemaLocation="http://integration.tmp.bosch.com/validation IntegrationConfiguration.xsd">
    <iv:messages>
		<!-- Configuration For ADT_A04 Message -->
        <iv:message iv:id="ADT_A04">
			<!-- Configuration For Required segments in a ADT_A04 Message -->
            <iv:segments>

				<!-- Configuration For PID in ADT_A04 Message -->
                <iv:segment iv:id="PID">
                    <iv:validations>
                        <iv:validation iv:type="MANDATORY">
                            <iv:value>true</iv:value>
                            <iv:fault>
                                <iv:faultInternalCode>SIA_PID_20</iv:faultInternalCode>
                                <iv:faultInternalMessage>Missing PID Segment</iv:faultInternalMessage>
                                <iv:faultExternalCode>SIA_PID_20</iv:faultExternalCode>
                                <iv:faultExternalMessage>Missing PID Segment</iv:faultExternalMessage>
                                <iv:segmentName>PID</iv:segmentName>
                                <iv:fieldNumber>0</iv:fieldNumber>
                                <iv:componentNumber>0</iv:componentNumber>
                            </iv:fault>
                        </iv:validation>
						<!--Check if all of the following ID codes Exist in PID3 fields -->
                        <iv:validation iv:type="MISSING_IDENTIFIER">
                            <iv:value>true</iv:value>
                            <iv:faults>
                                <iv:fault iv:id="PS">
                                    <iv:faultInternalCode>SIA_PID_400</iv:faultInternalCode>
                                    <iv:faultInternalMessage>Missing Patient System ID</iv:faultInternalMessage>
                                    <iv:faultExternalCode>SIA_PID_400</iv:faultExternalCode>
                                    <iv:faultExternalMessage>Missing Patient System ID</iv:faultExternalMessage>
                                    <iv:segmentName>PID</iv:segmentName>
                                    <iv:fieldNumber>3</iv:fieldNumber>
                                    <iv:componentNumber>1</iv:componentNumber>
                                </iv:fault>
                                <iv:fault iv:id="SS">
                                    <iv:faultInternalCode>SIA_PID_410</iv:faultInternalCode>
                                    <iv:faultInternalMessage>SSN is Missing</iv:faultInternalMessage>
                                    <iv:faultExternalCode>SIA_PID_410</iv:faultExternalCode>
                                    <iv:faultExternalMessage>Missing SSN</iv:faultExternalMessage>
                                    <iv:segmentName>PID</iv:segmentName>
                                    <iv:fieldNumber>3</iv:fieldNumber>
                                    <iv:componentNumber>1</iv:componentNumber>
                                </iv:fault> 
                            </iv:faults>
                        </iv:validation>
                    </iv:validations>
				    <iv:fields>
                        <!--Validation for PID5 containing patient last name-->
                        <iv:field iv:id="PID5">
                            <iv:validations>
                                <iv:validation iv:type="MANDATORY">
                                    <iv:value>true</iv:value>
                                    <iv:fault>
                                        <iv:faultInternalCode>SIA_PID_420</iv:faultInternalCode>
                                        <iv:faultInternalMessage>Missing PID5 Segment</iv:faultInternalMessage>
                                        <iv:faultExternalCode>SIA_PID_420</iv:faultExternalCode>
                                        <iv:faultExternalMessage>Missing Last Name</iv:faultExternalMessage>
                                        <iv:segmentName>PID</iv:segmentName>
                                        <iv:fieldNumber>5</iv:fieldNumber>
                                        <iv:componentNumber>0</iv:componentNumber>
                                    </iv:fault>
                                </iv:validation>
                            </iv:validations>
                            <iv:dataTypes>
								<!-- Validating the Last Name which is present in pid5.xpn1.fn1-->
                                <iv:dataType iv:id="XPN1_FN1">
                                    <iv:validations>
                                        <iv:validation iv:type="MANDATORY">
                                            <iv:value>true</iv:value>
                                            <iv:fault>
                                                <iv:faultInternalCode>SIA_PID_420</iv:faultInternalCode>
                                                <iv:faultInternalMessage>LastName is missing</iv:faultInternalMessage>
                                                <iv:faultExternalCode>SIA_PID_420</iv:faultExternalCode>
                                                <iv:faultExternalMessage>Missing Last Name</iv:faultExternalMessage>
                                                <iv:segmentName>PID</iv:segmentName>
                                                <iv:fieldNumber>5</iv:fieldNumber>
                                                <iv:componentNumber>1</iv:componentNumber>
                                            </iv:fault>
                                        </iv:validation>
                                  </iv:validations>
                                </iv:dataType>
                           </iv:dataTypes>
                       </iv:field>
                        	<!--Validation for PID7 containing patient DOB-->
                        <iv:field iv:id="PID7">
                            <iv:validations>
                                <iv:validation iv:type="MANDATORY">
                                    <iv:value>true</iv:value>
                                    <iv:fault>
                                        <iv:faultInternalCode>SIA_PID_430</iv:faultInternalCode>
                                        <iv:faultInternalMessage>Missing PID7 Segment</iv:faultInternalMessage>
                                        <iv:faultExternalCode>SIA_PID_430</iv:faultExternalCode>
                                        <iv:faultExternalMessage>Missing DOB</iv:faultExternalMessage>
                                        <iv:segmentName>PID</iv:segmentName>
                                        <iv:fieldNumber>7</iv:fieldNumber>
                                        <iv:componentNumber>0</iv:componentNumber>
                                    </iv:fault>
                                </iv:validation>
                            </iv:validations>
                            <iv:dataTypes>
								<!--Validation for TS1 which contains date of birth -->
                                <iv:dataType iv:id="TS1">
                                    <iv:validations>
                                        <iv:validation iv:type="MANDATORY">
                                            <iv:value>true</iv:value>
                                            <iv:fault>
                                                <iv:faultInternalCode>SIA_PID_430</iv:faultInternalCode>
                                                <iv:faultInternalMessage>Missing DOB</iv:faultInternalMessage>
                                                <iv:faultExternalCode>SIA_PID_430</iv:faultExternalCode>
                                                <iv:faultExternalMessage>Missing DOB</iv:faultExternalMessage>
                                                <iv:segmentName>PID</iv:segmentName>
                                                <iv:fieldNumber>7</iv:fieldNumber>
                                                <iv:componentNumber>1</iv:componentNumber>
                                            </iv:fault>
                                        </iv:validation>
                                    </iv:validations>
                                </iv:dataType>
                            </iv:dataTypes>
                        </iv:field>
                     </iv:fields>
                </iv:segment>
				<!--
 Configuration For EVN in ADT_A04 Message
                  EVN fields are not validated in ADT_A04 message for SA
				-->
                <iv:segment iv:id="EVN">
                    <iv:validations>
                        <iv:validation iv:type="MANDATORY">
                            <iv:value>true</iv:value>
                            <iv:fault>
                                <iv:faultInternalCode>SIA_EVN_40</iv:faultInternalCode>
                                <iv:faultInternalMessage>Missing EVN Segment</iv:faultInternalMessage>
                                <iv:faultExternalCode>SIA_EVN_40</iv:faultExternalCode>
                                <iv:faultExternalMessage>Missing EVN Segment</iv:faultExternalMessage>
                                <iv:segmentName>EVN</iv:segmentName>
                                <iv:fieldNumber>0</iv:fieldNumber>
                                <iv:componentNumber>0</iv:componentNumber>
                            </iv:fault>
                        </iv:validation>
                    </iv:validations>
                </iv:segment>
				<!--Configuration For PV1 in ADT_A04 Message -->
                <iv:segment iv:id="PV1">
                    <iv:validations>
                        <iv:validation iv:type="MANDATORY">
                            <iv:value>true</iv:value>
                            <iv:fault>